{
  "$schema": "https://json-schema.org/draft/2020-12/schema",
  "$id": "https://github.com/HansBug/pyfcstm/research/numeric-render-semantics/schemas/java_rust_smoke.schema.json",
  "title": "Java and Rust numeric smoke summary",
  "type": "object",
  "required": [
    "schema_version",
    "mode",
    "language",
    "source_mapping_sha256",
    "render_mapping_sha256",
    "summary_status",
    "generator",
    "repository",
    "toolchain",
    "official_source_notes",
    "cases"
  ],
  "properties": {
    "schema_version": {
      "const": 1
    },
    "mode": {
      "enum": [
        "java-smoke",
        "rust-smoke",
        "java-rust-smoke"
      ]
    },
    "language": {
      "enum": [
        "java",
        "rust",
        "java-rust"
      ]
    },
    "source_mapping_sha256": {
      "type": "string",
      "pattern": "^[0-9a-f]{64}$"
    },
    "render_mapping_sha256": {
      "type": "string",
      "pattern": "^[0-9a-f]{64}$"
    },
    "summary_status": {
      "type": "string"
    },
    "generator": {
      "type": "object",
      "required": [
        "tool",
        "research_path",
        "source_commit",
        "source_commit_policy",
        "determinism"
      ],
      "properties": {
        "tool": {
          "type": "string"
        },
        "research_path": {
          "type": "string"
        },
        "source_commit": {
          "type": [
            "string",
            "null"
          ],
          "pattern": "^[0-9a-f]{40}$"
        },
        "source_commit_policy": {
          "type": "string"
        },
        "determinism": {
          "type": "string"
        }
      }
    },
    "repository": {
      "type": "object",
      "required": [
        "root",
        "render_mapping_snapshot",
        "schema_path"
      ]
    },
    "toolchain": {
      "type": "object"
    },
    "render_paths": {
      "type": "array"
    },
    "official_source_notes": {
      "type": [
        "array",
        "object"
      ]
    },
    "languages": {
      "type": "object",
      "required": [
        "java",
        "rust"
      ],
      "properties": {
        "java": {
          "$ref": "#/$defs/java_payload"
        },
        "rust": {
          "$ref": "#/$defs/rust_payload"
        }
      }
    },
    "cases": {
      "type": "array",
      "minItems": 1,
      "items": {
        "$ref": "#/$defs/native_case"
      }
    },
    "validation_errors": {
      "type": "array"
    }
  },
  "allOf": [
    {
      "if": {
        "required": [
          "mode"
        ],
        "properties": {
          "mode": {
            "const": "java-smoke"
          }
        }
      },
      "then": {
        "required": [
          "language"
        ],
        "properties": {
          "language": {
            "const": "java"
          }
        }
      }
    },
    {
      "if": {
        "required": [
          "mode"
        ],
        "properties": {
          "mode": {
            "const": "rust-smoke"
          }
        }
      },
      "then": {
        "required": [
          "language"
        ],
        "properties": {
          "language": {
            "const": "rust"
          }
        }
      }
    },
    {
      "if": {
        "required": [
          "mode"
        ],
        "properties": {
          "mode": {
            "const": "java-rust-smoke"
          }
        }
      },
      "then": {
        "required": [
          "language",
          "languages"
        ],
        "properties": {
          "language": {
            "const": "java-rust"
          },
          "languages": {
            "type": "object",
            "required": [
              "java",
              "rust"
            ]
          }
        }
      }
    }
  ],
  "$defs": {
    "java_payload": {
      "type": "object",
      "required": [
        "mode",
        "language",
        "cases"
      ],
      "properties": {
        "mode": {
          "const": "java-smoke"
        },
        "language": {
          "const": "java"
        },
        "cases": {
          "type": "array",
          "minItems": 1,
          "items": {
            "$ref": "#/$defs/java_case"
          }
        }
      }
    },
    "rust_payload": {
      "type": "object",
      "required": [
        "mode",
        "language",
        "cases"
      ],
      "properties": {
        "mode": {
          "const": "rust-smoke"
        },
        "language": {
          "const": "rust"
        },
        "cases": {
          "type": "array",
          "minItems": 1,
          "items": {
            "$ref": "#/$defs/rust_case"
          }
        }
      }
    },
    "java_case": {
      "allOf": [
        {
          "$ref": "#/$defs/native_case"
        },
        {
          "properties": {
            "language": {
              "const": "java"
            }
          }
        }
      ]
    },
    "rust_case": {
      "allOf": [
        {
          "$ref": "#/$defs/native_case"
        },
        {
          "properties": {
            "language": {
              "const": "rust"
            }
          }
        }
      ]
    },
    "native_case": {
      "type": "object",
      "required": [
        "case_id",
        "semantic_case_id",
        "language",
        "profile",
        "operator",
        "fcstm_expression",
        "render_path",
        "render_expression",
        "native_api_family",
        "native_only",
        "native_only_reason",
        "inputs",
        "source_note_ids",
        "status",
        "outcome",
        "reason",
        "commands"
      ],
      "properties": {
        "case_id": {
          "type": "string"
        },
        "semantic_case_id": {
          "type": "string"
        },
        "language": {
          "enum": [
            "java",
            "rust"
          ]
        },
        "profile": {
          "type": "string"
        },
        "operator": {
          "type": "string"
        },
        "fcstm_expression": {
          "type": "string"
        },
        "render_path": {
          "type": "string"
        },
        "render_expression": {
          "type": "string"
        },
        "native_api_family": {
          "enum": [
            "plain-int32",
            "plain-i32",
            "checked-exact",
            "narrowing-cast",
            "cast",
            "math-floating",
            "renderer-fallback",
            "wrapping",
            "checked",
            "overflowing",
            "saturating"
          ]
        },
        "native_only": {
          "const": true
        },
        "native_only_reason": {
          "const": "no_java_or_rust_template_in_current_repository"
        },
        "inputs": {
          "type": "object",
          "required": [
            "A",
            "B"
          ]
        },
        "source_note_ids": {
          "type": "array",
          "minItems": 1,
          "items": {
            "type": "string"
          }
        },
        "status": {
          "enum": [
            "passed",
            "compile_failed",
            "runtime_failed",
            "skipped",
            "unavailable",
            "unknown"
          ]
        },
        "outcome": {
          "enum": [
            "observed",
            "compile_failed",
            "runtime_trap",
            "unavailable",
            "unknown"
          ]
        },
        "reason": {
          "type": [
            "string",
            "null"
          ]
        },
        "commands": {
          "type": "object"
        }
      },
      "additionalProperties": true
    }
  }
}
