{
  "cases": [
    {
      "case_id": "java-int32:int_add_overflow_wrap",
      "commands": {
        "run": {
          "args": [
            "<path>",
            "ProbeCase.java"
          ],
          "duration_seconds": "<duration>",
          "returncode": 0,
          "start_error": null,
          "stderr": "",
          "stdout": "VALUE=-2147483648\n",
          "timed_out": false
        }
      },
      "compile_strategy": "java_source_file_launcher",
      "fcstm_expression": "A + B",
      "inputs": {
        "A": 2147483647,
        "B": 1
      },
      "language": "java",
      "native_api_family": "plain-int32",
      "native_only": true,
      "native_only_reason": "no_java_or_rust_template_in_current_repository",
      "operator": "+",
      "outcome": "observed",
      "profile": "java-int32",
      "reason": null,
      "render_expression": "A + B",
      "render_path": "native_java",
      "semantic_case_id": "int_add_overflow_wrap",
      "source_note_ids": [
        "jls-integer-overflow"
      ],
      "source_path": "<local>",
      "status": "passed",
      "stderr": "",
      "stdout": "VALUE=-2147483648"
    },
    {
      "case_id": "java-int32:int_division_truncates",
      "commands": {
        "run": {
          "args": [
            "<path>",
            "ProbeCase.java"
          ],
          "duration_seconds": "<duration>",
          "returncode": 0,
          "start_error": null,
          "stderr": "",
          "stdout": "VALUE=-3\n",
          "timed_out": false
        }
      },
      "compile_strategy": "java_source_file_launcher",
      "fcstm_expression": "A / B",
      "inputs": {
        "A": -7,
        "B": 2
      },
      "language": "java",
      "native_api_family": "plain-int32",
      "native_only": true,
      "native_only_reason": "no_java_or_rust_template_in_current_repository",
      "operator": "/",
      "outcome": "observed",
      "profile": "java-int32",
      "reason": null,
      "render_expression": "A / B",
      "render_path": "native_java",
      "semantic_case_id": "int_division_truncates",
      "source_note_ids": [
        "jls-div-rem"
      ],
      "source_path": "<local>",
      "status": "passed",
      "stderr": "",
      "stdout": "VALUE=-3"
    },
    {
      "case_id": "java-int32:int_remainder_dividend_sign",
      "commands": {
        "run": {
          "args": [
            "<path>",
            "ProbeCase.java"
          ],
          "duration_seconds": "<duration>",
          "returncode": 0,
          "start_error": null,
          "stderr": "",
          "stdout": "VALUE=-1\n",
          "timed_out": false
        }
      },
      "compile_strategy": "java_source_file_launcher",
      "fcstm_expression": "A % B",
      "inputs": {
        "A": -7,
        "B": 2
      },
      "language": "java",
      "native_api_family": "plain-int32",
      "native_only": true,
      "native_only_reason": "no_java_or_rust_template_in_current_repository",
      "operator": "%",
      "outcome": "observed",
      "profile": "java-int32",
      "reason": null,
      "render_expression": "A % B",
      "render_path": "native_java",
      "semantic_case_id": "int_remainder_dividend_sign",
      "source_note_ids": [
        "jls-div-rem"
      ],
      "source_path": "<local>",
      "status": "passed",
      "stderr": "",
      "stdout": "VALUE=-1"
    },
    {
      "case_id": "java-int32:division_by_zero_exception",
      "commands": {
        "run": {
          "args": [
            "<path>",
            "ProbeCase.java"
          ],
          "duration_seconds": "<duration>",
          "returncode": 10,
          "start_error": null,
          "stderr": "",
          "stdout": "EXCEPTION=java.lang.ArithmeticException:/ by zero\n",
          "timed_out": false
        }
      },
      "compile_strategy": "java_source_file_launcher",
      "fcstm_expression": "A / B",
      "inputs": {
        "A": 7,
        "B": 0
      },
      "language": "java",
      "native_api_family": "plain-int32",
      "native_only": true,
      "native_only_reason": "no_java_or_rust_template_in_current_repository",
      "operator": "/",
      "outcome": "runtime_trap",
      "profile": "java-int32",
      "reason": "java_exception_or_nonzero",
      "render_expression": "A / B",
      "render_path": "native_java",
      "semantic_case_id": "division_by_zero_exception",
      "source_note_ids": [
        "jls-div-rem"
      ],
      "source_path": "<local>",
      "status": "runtime_failed",
      "stderr": "",
      "stdout": "EXCEPTION=java.lang.ArithmeticException:/ by zero"
    },
    {
      "case_id": "java-int32:bitwise_and_mask",
      "commands": {
        "run": {
          "args": [
            "<path>",
            "ProbeCase.java"
          ],
          "duration_seconds": "<duration>",
          "returncode": 0,
          "start_error": null,
          "stderr": "",
          "stdout": "VALUE=8\n",
          "timed_out": false
        }
      },
      "compile_strategy": "java_source_file_launcher",
      "fcstm_expression": "A & B",
      "inputs": {
        "A": 10,
        "B": 12
      },
      "language": "java",
      "native_api_family": "plain-int32",
      "native_only": true,
      "native_only_reason": "no_java_or_rust_template_in_current_repository",
      "operator": "&",
      "outcome": "observed",
      "profile": "java-int32",
      "reason": null,
      "render_expression": "A & B",
      "render_path": "native_java",
      "semantic_case_id": "bitwise_and_mask",
      "source_note_ids": [
        "jls-integer-overflow"
      ],
      "source_path": "<local>",
      "status": "passed",
      "stderr": "",
      "stdout": "VALUE=8"
    },
    {
      "case_id": "java-int32:unary_minus_min_wrap",
      "commands": {
        "run": {
          "args": [
            "<path>",
            "ProbeCase.java"
          ],
          "duration_seconds": "<duration>",
          "returncode": 0,
          "start_error": null,
          "stderr": "",
          "stdout": "VALUE=-2147483648\n",
          "timed_out": false
        }
      },
      "compile_strategy": "java_source_file_launcher",
      "fcstm_expression": "-A",
      "inputs": {
        "A": -2147483648,
        "B": 0
      },
      "language": "java",
      "native_api_family": "plain-int32",
      "native_only": true,
      "native_only_reason": "no_java_or_rust_template_in_current_repository",
      "operator": "unary-",
      "outcome": "observed",
      "profile": "java-int32",
      "reason": null,
      "render_expression": "-A",
      "render_path": "native_java",
      "semantic_case_id": "unary_minus_min_wrap",
      "source_note_ids": [
        "jls-integer-overflow"
      ],
      "source_path": "<local>",
      "status": "passed",
      "stderr": "",
      "stdout": "VALUE=-2147483648"
    },
    {
      "case_id": "java-int32:shift_count_masking",
      "commands": {
        "run": {
          "args": [
            "<path>",
            "ProbeCase.java"
          ],
          "duration_seconds": "<duration>",
          "returncode": 0,
          "start_error": null,
          "stderr": "",
          "stdout": "VALUE=1\n",
          "timed_out": false
        }
      },
      "compile_strategy": "java_source_file_launcher",
      "fcstm_expression": "A << B",
      "inputs": {
        "A": 1,
        "B": 32
      },
      "language": "java",
      "native_api_family": "plain-int32",
      "native_only": true,
      "native_only_reason": "no_java_or_rust_template_in_current_repository",
      "operator": "<<",
      "outcome": "observed",
      "profile": "java-int32",
      "reason": null,
      "render_expression": "A << B",
      "render_path": "native_java",
      "semantic_case_id": "shift_count_masking",
      "source_note_ids": [
        "jls-shift-mask"
      ],
      "source_path": "<local>",
      "status": "passed",
      "stderr": "",
      "stdout": "VALUE=1"
    },
    {
      "case_id": "java-int8-cast:narrowing_int_to_byte",
      "commands": {
        "run": {
          "args": [
            "<path>",
            "ProbeCase.java"
          ],
          "duration_seconds": "<duration>",
          "returncode": 0,
          "start_error": null,
          "stderr": "",
          "stdout": "VALUE=-128\n",
          "timed_out": false
        }
      },
      "compile_strategy": "java_source_file_launcher",
      "fcstm_expression": "A",
      "inputs": {
        "A": 128,
        "B": 0
      },
      "language": "java",
      "native_api_family": "narrowing-cast",
      "native_only": true,
      "native_only_reason": "no_java_or_rust_template_in_current_repository",
      "operator": "cast",
      "outcome": "observed",
      "profile": "java-int8-cast",
      "reason": null,
      "render_expression": "(byte) A",
      "render_path": "native_java",
      "semantic_case_id": "narrowing_int_to_byte",
      "source_note_ids": [
        "jls-narrowing-conversion"
      ],
      "source_path": "<local>",
      "status": "passed",
      "stderr": "",
      "stdout": "VALUE=-128"
    },
    {
      "case_id": "java-double-math:math_pow_promotes_double",
      "commands": {
        "run": {
          "args": [
            "<path>",
            "ProbeCase.java"
          ],
          "duration_seconds": "<duration>",
          "returncode": 0,
          "start_error": null,
          "stderr": "",
          "stdout": "VALUE=9.0\n",
          "timed_out": false
        }
      },
      "compile_strategy": "java_source_file_launcher",
      "fcstm_expression": "A ** B",
      "inputs": {
        "A": 3,
        "B": 2
      },
      "language": "java",
      "native_api_family": "math-floating",
      "native_only": true,
      "native_only_reason": "no_java_or_rust_template_in_current_repository",
      "operator": "**",
      "outcome": "observed",
      "profile": "java-double-math",
      "reason": null,
      "render_expression": "Math.pow(A, B)",